Handle,Title,Published,Option1 Name,Option1 Value,Option2 Name,Option2 Value,Variant Inventory Tracker,Variant Inventory Qty,Variant Inventory Policy,Variant Fulfillment Service,Variant Price,Variant Requires Shipping,Variant Taxable,Image Src,Image Position,Description,Status,Rating
Dazzlingrock-Collection-0.35-Carat-(ctw)-Round-White-Diamond-Illusion-Framed-Wedding-Trio-Ring-Set-for-Men-&-Women-in-925-Sterling-Silver,Dazzlingrock Collection 0.35 Carat (ctw) Round White Diamond Illusion Framed Wedding Trio Ring Set for Men & Women in 925 Sterling Silver,true,Product details,📋【SPECIFICATIONS】 - 925 Sterling Silver | White Diamond Color: I-J | Clarity: I2-I3 🔹 Creation: Natural | Treatement: Not-treated 🔹 Round White Diamond(s) Weight: 0.35 Carat 🔹 Women's Ring Set Width: 9.2mm (0.36 inch) | Men's Band Width: 4.3mm (0.17 inch) 🔹 Model Number: K5115-4-7,Size,"['W-4 & M-7,W-4 & M-7.5,W-4 & M-8,W-4 & M-8.5,W-4 & M-9,W-4 & M-9.5,W-4 & M-10,W-4 & M-10.5,W-4 & M-11,W-4 & M-11.5,W-4 & M-12,W-4 & M-12.5,W-4 & M-13,W-4.5 & M-7,W-4.5 & M-7.5,W-4.5 & M-8,W-4.5 & M-8.5,W-4.5 & M-9,W-4.5 & M-9.5,W-4.5 & M-10,W-4.5 & M-10.5,W-4.5 & M-11,W-4.5 & M-11.5,W-4.5 & M-12,W-4.5 & M-12.5,W-4.5 & M-13,W-5 & M-7,W-5 & M-7.5,W-5 & M-8,W-5 & M-8.5,W-5 & M-9,W-5 & M-9.5,W-5 & M-10,W-5 & M-10.5,W-5 & M-11,W-5 & M-11.5,W-5 & M-12,W-5 & M-12.5,W-5 & M-13,W-5.5 & M-7,W-5.5 & M-7.5,W-5.5 & M-8,W-5.5 & M-8.5,W-5.5 & M-9,W-5.5 & M-9.5,W-5.5 & M-10,W-5.5 & M-10.5,W-5.5 & M-11,W-5.5 & M-11.5,W-5.5 & M-12,W-5.5 & M-12.5,W-5.5 & M-13,W-6 & M-7,W-6 & M-7.5,W-6 & M-8,W-6 & M-8.5,W-6 & M-9,W-6 & M-9.5,W-6 & M-10,W-6 & M-10.5,W-6 & M-11,W-6 & M-11.5,W-6 & M-12,W-6 & M-12.5,W-6 & M-13,W-6.5 & M-7,W-6.5 & M-7.5,W-6.5 & M-8,W-6.5 & M-8.5,W-6.5 & M-9,W-6.5 & M-9.5,W-6.5 & M-10,W-6.5 & M-10.5,W-6.5 & M-11,W-6.5 & M-11.5,W-6.5 & M-12,W-6.5 & M-12.5,W-6.5 & M-13,W-7 & M-7,W-7 & M-7.5,W-7 & M-8,W-7 & M-8.5,W-7 & M-9,W-7 & M-9.5,W-7 & M-10,W-7 & M-10.5,W-7 & M-11,W-7 & M-11.5,W-7 & M-12,W-7 & M-12.5,W-7 & M-13,W-7.5 & M-7,W-7.5 & M-7.5,W-7.5 & M-8,W-7.5 & M-8.5,W-7.5 & M-9,W-7.5 & M-9.5,W-7.5 & M-10,W-7.5 & M-10.5,W-7.5 & M-11,W-7.5 & M-11.5,W-7.5 & M-12,W-7.5 & M-12.5,W-7.5 & M-13,W-8 & M-7,W-8 & M-7.5,W-8 & M-8,W-8 & M-8.5,W-8 & M-9,W-8 & M-9.5,W-8 & M-10,W-8 & M-10.5,W-8 & M-11,W-8 & M-11.5,W-8 & M-12,W-8 & M-12.5,W-8 & M-13,W-8.5 & M-7,W-8.5 & M-7.5,W-8.5 & M-8,W-8.5 & M-8.5,W-8.5 & M-9,W-8.5 & M-9.5,W-8.5 & M-10,W-8.5 & M-10.5,W-8.5 & M-11,W-8.5 & M-11.5,W-8.5 & M-12,W-8.5 & M-12.5,W-8.5 & M-13,W-9 & M-7,W-9 & M-7.5,W-9 & M-8,W-9 & M-8.5,W-9 & M-9,W-9 & M-9.5,W-9 & M-10,W-9 & M-10.5,W-9 & M-11,W-9 & M-11.5,W-9 & M-12,W-9 & M-12.5,W-9 & M-13,W-9.5 & M-7,W-9.5 & M-7.5,W-9.5 & M-8,W-9.5 & M-8.5,W-9.5 & M-9,W-9.5 & M-9.5,W-9.5 & M-10,W-9.5 & M-10.5,W-9.5 & M-11,W-9.5 & M-11.5,W-9.5 & M-12,W-9.5 & M-12.5,W-9.5 & M-13,W-10 & M-7,W-10 & M-7.5,W-10 & M-8,W-10 & M-8.5,W-10 & M-9,W-10 & M-9.5,W-10 & M-10,W-10 & M-10.5,W-10 & M-11,W-10 & M-11.5,W-10 & M-12,W-10 & M-12.5,W-10 & M-13']",Shopify,1000,deny,manual,$270.84,TRUE,TRUE,"['https://m.media-amazon.com/images/W/MEDIAX_792452-T1/images/I/414oX-3c+XL._AC_US40_.jpg', 'https://m.media-amazon.com/images/W/MEDIAX_792452-T1/images/I/31icWil-JdL._AC_US40_.jpg', 'https://m.media-amazon.com/images/W/MEDIAX_792452-T1/images/I/311YTbHXbGL._AC_US40_.jpg', 'https://m.media-amazon.com/images/W/MEDIAX_792452-T1/images/I/41Ge7m916CL._AC_US40_.jpg', 'https://m.media-amazon.com/images/W/MEDIAX_792452-T1/images/I/41jUBrgMGaL._AC_US40_.jpg', 'https://m.media-amazon.com/images/W/MEDIAX_792452-T1/images/I/515j9MKp5vL._AC_US40_.jpg', 'https://m.media-amazon.com/images/W/MEDIAX_792452-T1/images/I/51F32630-JL._AC_US40_.jpg', 'https://images-na.ssl-images-amazon.com/images/G/01/x-locale/common/transparent-pixel._V192234675_.gif']",1,"📋【SPECIFICATIONS】 - 925 Sterling Silver | White Diamond Color: I-J | Clarity: I2-I3 🔹 Creation: Natural | Treatement: Not-treated 🔹 Round White Diamond(s) Weight: 0.35 Carat 🔹 Women's Ring Set Width: 9.2mm (0.36 inch) | Men's Band Width: 4.3mm (0.17 inch) 🔹 Model Number: K5115-4-7 💎 When it comes to giving gifts, there is always a DIAMOND as it means “FOREVER”; So make this the ultimate jewelry gift idea for Him, Fathers, Fiancé, Brothers and In-laws, Valentine's - Father's Day or Christmas. ❗【DISCLAIMER】 - Item(s) are smaller than what appears in photo; Photo enlarged to show detail. Please refer to the scale image under product photos for exact dimensions. ✅【GUARANTEE】 - All our stones are conflict free, our products are backed by incredible customer service and we offer a money back guarantee for 30 days. ⭐【90 DAY WARRANTY】 - We stand behind our products; Please read our 'About us' page for more info. We take product customization requests through Amazon Messages",active,4.1
Dazzlingrock-Collection-0.25-Carat-(ctw)-Round-White-Diamond-3-Row-Studded-Stackable-Wedding-Band-for-Women-in-10K-Gold,Dazzlingrock Collection 0.25 Carat (ctw) Round White Diamond 3 Row Studded Stackable Wedding Band for Women in 10K Gold,true,Product details,📋【SPECIFICATIONS】 - 10K Rose Gold 🔹 White Diamond Color: I-J | Clarity: I2-I3 | Creation: Natural | Treatment: Not-treated 🔹 Round White Diamond(s) Weight: 0.25 Carat 🔹 Product Width: 2.4mm (0.09 inch) 🔹 Model Number: K1438-10KR-4,Size,"['4,4.5,5,5.5,6,6.5,7,7.5,8,8.5,9,9.5,10']",Shopify,1000,deny,manual,$186.38,TRUE,TRUE,"['https://m.media-amazon.com/images/W/MEDIAX_792452-T1/images/I/41WIrA82frL._AC_US40_.jpg', 'https://m.media-amazon.com/images/W/MEDIAX_792452-T1/images/I/418lkta5ZRL._AC_US40_.jpg', 'https://m.media-amazon.com/images/W/MEDIAX_792452-T1/images/I/31Yd2tM7dbL._AC_US40_.jpg', 'https://m.media-amazon.com/images/W/MEDIAX_792452-T1/images/I/41XTHsQRltL._AC_US40_.jpg', 'https://m.media-amazon.com/images/W/MEDIAX_792452-T1/images/I/31+Ht1YpC9L._AC_US40_.jpg', 'https://m.media-amazon.com/images/W/MEDIAX_792452-T1/images/I/515j9MKp5vL._AC_US40_.jpg', 'https://m.media-amazon.com/images/W/MEDIAX_792452-T1/images/I/51b8V92K-lL.SS40_PKmb-play-button-overlay-thumb_.jpg', 'https://images-na.ssl-images-amazon.com/images/G/01/x-locale/common/transparent-pixel._V192234675_.gif']",1,"📋【SPECIFICATIONS】 - 10K Rose Gold 🔹 White Diamond Color: I-J | Clarity: I2-I3 | Creation: Natural | Treatment: Not-treated 🔹 Round White Diamond(s) Weight: 0.25 Carat 🔹 Product Width: 2.4mm (0.09 inch) 🔹 Model Number: K1438-10KR-4 💎 When it comes to giving gifts, there is always a DIAMOND as it means “FOREVER”; So make this the ultimate jewelry gift idea for Women, Wife, Fiancée, Moms, Sisters and In-laws, Valentine's - Anniversary, Mother's Day or Christmas. ❗【DISCLAIMER】 - Item(s) are smaller than what appears in photo; Photo enlarged to show detail. For precise dimensions, we kindly request you to refer to the scale image located under the product photos. It provides an accurate representation of the item's proportions, allowing you to make an informed decision about its size. ✅【GUARANTEE】 - We take great pride in ensuring that all our diamonds are ethically sourced, guaranteeing that they are conflict-free. Moreover, we go above and beyond to provide exceptional customer service to back our products. We proudly back our products with a generous 30-day money-back guarantee, providing you with complete peace of mind. ⭐【90 DAY WARRANTY】 - At our company, we take immense pride in the quality of our products, and we wholeheartedly stand behind them. For a deeper understanding of our values and mission, we invite you to explore our comprehensive 'About Us' page. To make your experience even more tailored, we welcome product customization requests through Amazon Messages, allowing you to personalize your order to perfection 🔸 If you require ring sizes not shown above, please reach out to us",active,4.2
Dazzlingrock-Collection-Alternate-Round-Ruby-&-White-Diamond-Wedding-Stackable-Band-for-Women-in-Gold,Dazzlingrock Collection Alternate Round Ruby & White Diamond Wedding Stackable Band for Women in Gold,true,Product details,📋【SPECIFICATIONS】 - 10K Rose Gold 🔹 Ruby Color: Red | Creation: Natural | Treatment: Heat-treated 🔹 White Diamond Color: I-J | Clarity: I2-I3 🔹 Round Natural Ruby(s) Weight: 0.09 Carat (approx) 🔹 Round White Diamond(s) Weight: 0.08 Carat 🔹 Product Width: 1.40mm (0.06 inch) 🔹 Model Number: DR7315-1486-10KR-4,Size,"['4,4.5,5,5.5,6,6.5,7,7.5,8,8.5,9,9.5,10']",Shopify,1000,deny,manual,$134.07,TRUE,TRUE,"['https://m.media-amazon.com/images/W/MEDIAX_792452-T1/images/I/41IOGnRZmUL._AC_US40_.jpg', 'https://m.media-amazon.com/images/W/MEDIAX_792452-T1/images/I/410YzhFjTqL._AC_US40_.jpg', 'https://m.media-amazon.com/images/W/MEDIAX_792452-T1/images/I/31pfkS0dI0L._AC_US40_.jpg', 'https://m.media-amazon.com/images/W/MEDIAX_792452-T1/images/I/31n7LG7Z2gL._AC_US40_.jpg', 'https://m.media-amazon.com/images/W/MEDIAX_792452-T1/images/I/41yRWUaAAfL._AC_US40_.jpg', 'https://m.media-amazon.com/images/W/MEDIAX_792452-T1/images/I/515j9MKp5vL._AC_US40_.jpg', 'https://m.media-amazon.com/images/W/MEDIAX_792452-T1/images/I/51AYeP7rZLL.SS40_PKmb-play-button-overlay-thumb_.jpg', 'https://images-na.ssl-images-amazon.com/images/G/01/x-locale/common/transparent-pixel._V192234675_.gif']",1,"📋【SPECIFICATIONS】 - 10K Rose Gold 🔹 Ruby Color: Red | Creation: Natural | Treatment: Heat-treated 🔹 White Diamond Color: I-J | Clarity: I2-I3 🔹 Round Natural Ruby(s) Weight: 0.09 Carat (approx) 🔹 Round White Diamond(s) Weight: 0.08 Carat 🔹 Product Width: 1.40mm (0.06 inch) 🔹 Model Number: DR7315-1486-10KR-4 💎 Ruby, did you know that a ruby is actually a red sapphire? The most precious form of Corundum, red ruby is the ultimate symbol of passionate love. ❗【DISCLAIMER】 - Item(s) are smaller than what appears in photo; Photo enlarged to show detail. Please refer to the scale image under product photos for exact dimensions. ✅【GUARANTEE】 - All our stones are conflict free, our products are backed by incredible customer service and we offer a money back guarantee for 30 days. ⭐【90 DAY WARRANTY】 - We stand behind our products; Please read our 'About us' page for more info. We take product customization requests through Amazon Messages",active,4.1
Dazzlingrock-Collection-Round-Blue-Sapphire-&-White-Diamond-Crisscross-Stackable-Wedding-Band-for-Women-in-925-Sterling-Silver,Dazzlingrock Collection Round Blue Sapphire & White Diamond Crisscross Stackable Wedding Band for Women in 925 Sterling Silver,true,Product details,📋SPECIFICATIONS - 925 Sterling Silver🔹Sapphire Color: Blue | Creation: Natural | Treatment: Heat-treated🔹White Diamond Color: I-J | Clarity: I2-I3🔹Natural Blue Sapphire Weight: 0.09 Carat (approx)🔹Round White Diamond(s) Weight: 0.13 Carat🔹Product Width: 3.90mm (0.15 inch) 🔹 Model Number: K7100-4,Size,"['4,4.5,5,5.5,6,6.5,7,7.5,8,8.5,9,9.5,10']",Shopify,1000,deny,manual,$94.44,TRUE,TRUE,"['https://m.media-amazon.com/images/W/MEDIAX_792452-T1/images/I/41d1W1vDRvL._AC_US40_.jpg', 'https://m.media-amazon.com/images/W/MEDIAX_792452-T1/images/I/31UY1UIgDKL._AC_US40_.jpg', 'https://m.media-amazon.com/images/W/MEDIAX_792452-T1/images/I/41SvsAp0s7L._AC_US40_.jpg', 'https://m.media-amazon.com/images/W/MEDIAX_792452-T1/images/I/31FLiLVmUGL._AC_US40_.jpg', 'https://m.media-amazon.com/images/W/MEDIAX_792452-T1/images/I/41wly1pX6rL._AC_US40_.jpg', 'https://m.media-amazon.com/images/W/MEDIAX_792452-T1/images/I/515j9MKp5vL._AC_US40_.jpg', 'https://m.media-amazon.com/images/W/MEDIAX_792452-T1/images/I/91nY2wKBiPL.SS40_PKmb-play-button-overlay-thumb_.jpg', 'https://images-na.ssl-images-amazon.com/images/G/01/x-locale/common/transparent-pixel._V192234675_.gif']",1,"📋SPECIFICATIONS - 925 Sterling Silver🔹Sapphire Color: Blue | Creation: Natural | Treatment: Heat-treated🔹White Diamond Color: I-J | Clarity: I2-I3🔹Natural Blue Sapphire Weight: 0.09 Carat (approx)🔹Round White Diamond(s) Weight: 0.13 Carat🔹Product Width: 3.90mm (0.15 inch) 🔹 Model Number: K7100-4 💎 Blue Sapphire, these regal gemstones are fit for royalty; Princess Diana and Kate both chose this blue stone over traditional white diamonds; Meaning: You'll always be honest and loyal to each other. ❗【DISCLAIMER】 - Item(s) are smaller than what appears in photo; Photo enlarged to show detail. Please refer to the scale image under product photos for exact dimensions. ✅【GUARANTEE】 - All our diamonds are conflict free, our products are backed by incredible customer service and we offer a money back guarantee for 30 days. ⭐【90 DAY WARRANTY】 - We stand behind our products; Please read our 'About us' page for more info. We take product customization requests through Amazon Messages",active,4.3
"Dazzlingrock-Collection-Round-White-Diamond-Beaded-Chevron-Wedding-Band-for-Women-(0.25-ctw,-Color-I-J,-Clarity-I1-I3)-in-Gold","Dazzlingrock Collection Round White Diamond Beaded Chevron Wedding Band for Women (0.25 ctw, Color I-J, Clarity I1-I3) in Gold",true,Product details,📋【SPECIFICATIONS】 - 10K Rose Gold 🔹 White Diamond Color: I-J | Clarity: I2-I3 | Creation: Natural | Treatment: Not-treated 🔹 Round White Diamond(s) Weight: 0.25 Carat 🔹 Product Width: 5.80mm (0.23 inch) 🔹 Model Number: K6339-10KR-4,Size,"['4,4.5,5,5.5,6,6.5,6.75,7,7.5,8,8.5,9,9.5,10']",Shopify,1000,deny,manual,$250.08,TRUE,TRUE,"['https://m.media-amazon.com/images/W/MEDIAX_792452-T1/images/I/41x1lX-6qFL._AC_US40_.jpg', 'https://m.media-amazon.com/images/W/MEDIAX_792452-T1/images/I/41tfKhYWfqL._AC_US40_.jpg', 'https://m.media-amazon.com/images/W/MEDIAX_792452-T1/images/I/41EIsiY-Z0L._AC_US40_.jpg', 'https://m.media-amazon.com/images/W/MEDIAX_792452-T1/images/I/41TYXj9hymL._AC_US40_.jpg', 'https://m.media-amazon.com/images/W/MEDIAX_792452-T1/images/I/41uBCNZtCXL._AC_US40_.jpg', 'https://m.media-amazon.com/images/W/MEDIAX_792452-T1/images/I/515j9MKp5vL._AC_US40_.jpg', 'https://images-na.ssl-images-amazon.com/images/G/01/x-locale/common/transparent-pixel._V192234675_.gif']",1,"📋【SPECIFICATIONS】 - 10K Rose Gold 🔹 White Diamond Color: I-J | Clarity: I2-I3 | Creation: Natural | Treatment: Not-treated 🔹 Round White Diamond(s) Weight: 0.25 Carat 🔹 Product Width: 5.80mm (0.23 inch) 🔹 Model Number: K6339-10KR-4 💎 When it comes to giving gifts, there is always a DIAMOND as it means “FOREVER”; So make this the ultimate jewelry gift idea for Women, Wife, Fiancée, Moms, Sisters and In-laws, Valentine's - Anniversary, Mother's Day or Christmas. ❗【DISCLAIMER】 - Item(s) are smaller than what appears in photo; Photo enlarged to show detail. Please refer to the scale image under product photos for exact dimensions. ✅【GUARANTEE】 - All our diamonds are conflict free, our products are backed by incredible customer service and we offer a money back guarantee for 30 days. ⭐【90 DAY WARRANTY】 - We stand behind our products; Please read our 'About us' page for more info. We take product customization requests through Amazon Messages",active,4.2
Dazzlingrock-Collection-0.48-Carat-Round-White-Diamond-Cluster-Trio-Ring-Set-in-925-Sterling-Silver,Dazzlingrock Collection 0.48 Carat Round White Diamond Cluster Trio Ring Set in 925 Sterling Silver,true,Product details,📋【SPECIFICATIONS】 - 925 Sterling Silver 🔹 White Diamond Color: I-J | Clarity: I2-I3 🔹 White Diamond Total Weight: 0.48 Carat 🔹 Product Width: 8.89mm (0.35 inch) 🔹 Model Number: K6916-4-7,Size,"['W-4 & M-7,W-4 & M-7.5,W-4 & M-8,W-4 & M-8.5,W-4 & M-9,W-4 & M-9.5,W-4 & M-10,W-4 & M-10.5,W-4 & M-11,W-4 & M-11.5,W-4 & M-12,W-4 & M-12.5,W-4 & M-13,W-4.5 & M-7,W-4.5 & M-7.5,W-4.5 & M-8,W-4.5 & M-8.5,W-4.5 & M-9,W-4.5 & M-9.5,W-4.5 & M-10,W-4.5 & M-10.5,W-4.5 & M-11,W-4.5 & M-11.5,W-4.5 & M-12,W-4.5 & M-12.5,W-4.5 & M-13,W-5 & M-7,W-5 & M-7.5,W-5 & M-8,W-5 & M-8.5,W-5 & M-9,W-5 & M-9.5,W-5 & M-10,W-5 & M-10.5,W-5 & M-11,W-5 & M-11.5,W-5 & M-12,W-5 & M-12.5,W-5 & M-13,W-5.5 & M-7,W-5.5 & M-7.5,W-5.5 & M-8,W-5.5 & M-8.5,W-5.5 & M-9,W-5.5 & M-9.5,W-5.5 & M-10,W-5.5 & M-10.5,W-5.5 & M-11,W-5.5 & M-11.5,W-5.5 & M-12,W-5.5 & M-12.5,W-5.5 & M-13,W-6 & M-7,W-6 & M-7.5,W-6 & M-8,W-6 & M-8.5,W-6 & M-9,W-6 & M-9.5,W-6 & M-10,W-6 & M-10.5,W-6 & M-11,W-6 & M-11.5,W-6 & M-12,W-6 & M-12.5,W-6 & M-13,W-6.5 & M-7,W-6.5 & M-7.5,W-6.5 & M-8,W-6.5 & M-8.5,W-6.5 & M-9,W-6.5 & M-9.5,W-6.5 & M-10,W-6.5 & M-10.5,W-6.5 & M-11,W-6.5 & M-11.5,W-6.5 & M-12,W-6.5 & M-12.5,W-6.5 & M-13,W-7 & M-7,W-7 & M-7.5,W-7 & M-8,W-7 & M-8.5,W-7 & M-9,W-7 & M-9.5,W-7 & M-10,W-7 & M-10.5,W-7 & M-11,W-7 & M-11.5,W-7 & M-12,W-7 & M-12.5,W-7 & M-13,W-7.5 & M-7,W-7.5 & M-7.5,W-7.5 & M-8,W-7.5 & M-8.5,W-7.5 & M-9,W-7.5 & M-9.5,W-7.5 & M-10,W-7.5 & M-10.5,W-7.5 & M-11,W-7.5 & M-11.5,W-7.5 & M-12,W-7.5 & M-12.5,W-7.5 & M-13,W-8 & M-7,W-8 & M-7.5,W-8 & M-8,W-8 & M-8.5,W-8 & M-9,W-8 & M-9.5,W-8 & M-10,W-8 & M-10.5,W-8 & M-11,W-8 & M-11.5,W-8 & M-12,W-8 & M-12.5,W-8 & M-13,W-8.5 & M-7,W-8.5 & M-7.5,W-8.5 & M-8,W-8.5 & M-8.5,W-8.5 & M-9,W-8.5 & M-9.5,W-8.5 & M-10,W-8.5 & M-10.5,W-8.5 & M-11,W-8.5 & M-11.5,W-8.5 & M-12,W-8.5 & M-12.5,W-8.5 & M-13,W-9 & M-7,W-9 & M-7.5,W-9 & M-8,W-9 & M-8.5,W-9 & M-9,W-9 & M-9.5,W-9 & M-10,W-9 & M-10.5,W-9 & M-11,W-9 & M-11.5,W-9 & M-12,W-9 & M-12.5,W-9 & M-13,W-9.5 & M-7,W-9.5 & M-7.5,W-9.5 & M-8,W-9.5 & M-8.5,W-9.5 & M-9,W-9.5 & M-9.5,W-9.5 & M-10,W-9.5 & M-10.5,W-9.5 & M-11,W-9.5 & M-11.5,W-9.5 & M-12,W-9.5 & M-12.5,W-9.5 & M-13,W-10 & M-7,W-10 & M-7.5,W-10 & M-8,W-10 & M-8.5,W-10 & M-9,W-10 & M-9.5,W-10 & M-10,W-10 & M-10.5,W-10 & M-11,W-10 & M-11.5,W-10 & M-12,W-10 & M-12.5,W-10 & M-13']",Shopify,1000,deny,manual,$315.34,TRUE,TRUE,"['https://m.media-amazon.com/images/W/MEDIAX_792452-T1/images/I/518yIade8cL._AC_US40_.jpg', 'https://m.media-amazon.com/images/W/MEDIAX_792452-T1/images/I/31PkUKpcbQL._AC_US40_.jpg', 'https://m.media-amazon.com/images/W/MEDIAX_792452-T1/images/I/41jWPYzrz3L._AC_US40_.jpg', 'https://m.media-amazon.com/images/W/MEDIAX_792452-T1/images/I/41q6kM+i+bL._AC_US40_.jpg', 'https://m.media-amazon.com/images/W/MEDIAX_792452-T1/images/I/414WtBHJtRL._AC_US40_.jpg', 'https://m.media-amazon.com/images/W/MEDIAX_792452-T1/images/I/515j9MKp5vL._AC_US40_.jpg', 'https://m.media-amazon.com/images/W/MEDIAX_792452-T1/images/I/51BtECpefkL._AC_US40_.jpg', 'https://images-na.ssl-images-amazon.com/images/G/01/x-locale/common/transparent-pixel._V192234675_.gif']",1,"📋【SPECIFICATIONS】 - 925 Sterling Silver 🔹 White Diamond Color: I-J | Clarity: I2-I3 🔹 White Diamond Total Weight: 0.48 Carat 🔹 Product Width: 8.89mm (0.35 inch) 🔹 Model Number: K6916-4-7 💎 When it comes to giving gifts, there is always a DIAMOND as it means “FOREVER”; So make this the ultimate jewelry gift idea for Women-Men, Mom-Dad, Fiancée-Fiancé, Sisters-Brothers and In-laws, Valentine's - Mother's-Father's Day or Christmas. ❗【DISCLAIMER】 - Enlarge photos to show the detail of the item. To get an accurate understanding of the dimensions of the item we recommend refer to the scale image provided under the product photos. The scale image is typically a representation of the item's size in relation to a commonly recognizable object or measurement. ✅【GUARANTEE】 - Ensuring that diamonds are conflict-free is an important aspect of ethical sourcing. Offering a money-back guarantee within a reasonable timeframe, such as 30 days, demonstrates confidence in the quality and value of our products. ⭐【90 DAY WARRANTY】 - It's great to hear that we stand behind our products & encourage customers to read our 'About Us' page for more information. Providing transparency & details about our brand & taking product customization requests through Amazon Messages is a convenient and customer-friendly approach.",active,4.4
"Dazzlingrock-Collection-Round-Black-Diamond-Stackable-Wedding-Band-for-Women-(0.10-ctw,-Color-Black,-Clarity-Opaque)-in-925-Sterling-Silver","Dazzlingrock Collection Round Black Diamond Stackable Wedding Band for Women (0.10 ctw, Color Black, Clarity Opaque) in 925 Sterling Silver",true,Product details,📋【SPECIFICATIONS】 - 925 Sterling Silver 🔹 Diamond Color: Black | Clarity: Opaque | Creation: Natural | Treatment: Treated for Color(permanent) 🔹 Round Black Diamond(s) Weight: 0.10 Carat 🔹 Product Width: 2.20mm (0.09 inch) 🔹 Model Number: K1502-4,Size,"['4,4.5,5,5.5,6,6.5,7,7.5,8,8.5,9,9.5,10']",Shopify,1000,deny,manual,$70.79,TRUE,TRUE,"['https://m.media-amazon.com/images/W/MEDIAX_792452-T1/images/I/41mH1U0KFZL._AC_US40_.jpg', 'https://m.media-amazon.com/images/W/MEDIAX_792452-T1/images/I/41+4P0TaEbL._AC_US40_.jpg', 'https://m.media-amazon.com/images/W/MEDIAX_792452-T1/images/I/31jnBU+O3FL._AC_US40_.jpg', 'https://m.media-amazon.com/images/W/MEDIAX_792452-T1/images/I/31WXIhOfEDL._AC_US40_.jpg', 'https://m.media-amazon.com/images/W/MEDIAX_792452-T1/images/I/41XxN8762XL._AC_US40_.jpg', 'https://m.media-amazon.com/images/W/MEDIAX_792452-T1/images/I/515j9MKp5vL._AC_US40_.jpg', 'https://m.media-amazon.com/images/I/91QUFvJflyL.SS40_PKmb-play-button-overlay-thumb_.png', 'https://images-na.ssl-images-amazon.com/images/G/01/x-locale/common/transparent-pixel._V192234675_.gif']",1,"📋【SPECIFICATIONS】 - 925 Sterling Silver 🔹 Diamond Color: Black | Clarity: Opaque | Creation: Natural | Treatment: Treated for Color(permanent) 🔹 Round Black Diamond(s) Weight: 0.10 Carat 🔹 Product Width: 2.20mm (0.09 inch) 🔹 Model Number: K1502-4 💎 Black Diamonds may have one or two small chips or white spots. The black diamonds in this item are semi-faceted, natural, qualify as rose-cut or diamond accents, are not of gem quality, and contain varying number of facets from 0 to 16. Natural black diamonds are rare. We sell only black diamonds treated with the High Pressure Heat Treatment (HPHT) method, in which diamonds are heated to approximately 1260° C, and the diamonds become black. HPHT treatment is completely safe and permanent. ❗【DISCLAIMER】 - Item(s) are smaller than what appears in photo; Photo enlarged to show detail. Please refer to the scale image under product photos for exact dimensions. ✅【GUARANTEE】 - All our stones are conflict free, our products are backed by incredible customer service and we offer a money back guarantee for 30 days. ⭐【90 DAY WARRANTY】 - We stand behind our products; Please read our 'About us' page for more info. We take product customization requests through Amazon Messages",active,4.2
"Dazzlingrock-Collection-Round-White-Diamond-Stackable-Wedding-Band-for-Women-(0.08-ctw,-Color-I-J,-Clarity-I1-I2)-in-14K-Gold","Dazzlingrock Collection Round White Diamond Stackable Wedding Band for Women (0.08 ctw, Color I-J, Clarity I1-I2) in 14K Gold",true,Product details,📋【SPECIFICATIONS】 - 14K Rose Gold 🔹 White Diamond Color: I-J | Clarity: I1-I2 | Creation: Natural | Treatment: Not-treated 🔹 Round White Diamond(s) Weight: 0.08 Carat 🔹 Product Width: 1.00mm (0.03 inch) 🔹 Model Number: K1986-14KR-4,Size,"['4,4.5,5,5.5,6,6.5,7,7.5,8,8.5,9,9.5,10']",Shopify,1000,deny,manual,$176.26,TRUE,TRUE,"['https://m.media-amazon.com/images/W/MEDIAX_792452-T1/images/I/31bzLYgZHWL._AC_US40_.jpg', 'https://m.media-amazon.com/images/W/MEDIAX_792452-T1/images/I/41KayXPyelL._AC_US40_.jpg', 'https://m.media-amazon.com/images/W/MEDIAX_792452-T1/images/I/41p1I7DxNtS._AC_US40_.jpg', 'https://m.media-amazon.com/images/W/MEDIAX_792452-T1/images/I/31-JrrVcU2L._AC_US40_.jpg', 'https://m.media-amazon.com/images/W/MEDIAX_792452-T1/images/I/312vQNYRBAL._AC_US40_.jpg', 'https://m.media-amazon.com/images/W/MEDIAX_792452-T1/images/I/4115KN18OhL._AC_US40_.jpg', 'https://m.media-amazon.com/images/W/MEDIAX_792452-T1/images/I/51noNxQssaL.SS40_PKmb-play-button-overlay-thumb_.jpg', 'https://images-na.ssl-images-amazon.com/images/G/01/x-locale/common/transparent-pixel._V192234675_.gif']",1,"📋【SPECIFICATIONS】 - 14K Rose Gold 🔹 White Diamond Color: I-J | Clarity: I1-I2 | Creation: Natural | Treatment: Not-treated 🔹 Round White Diamond(s) Weight: 0.08 Carat 🔹 Product Width: 1.00mm (0.03 inch) 🔹 Model Number: K1986-14KR-4 💎 When it comes to giving gifts, there is always a DIAMOND as it means “FOREVER”; So make this the ultimate jewelry gift idea for Women, Wife, Fiancée, Moms, Sisters and In-laws, Valentine's - Anniversary, Mother's Day or Christmas. ❗【DISCLAIMER】 - Item(s) are smaller than what appears in photo; Photo enlarged to show detail. Please refer to the scale image under product photos for exact dimensions. ✅【GUARANTEE】 - All our diamonds are conflict free, our products are backed by incredible customer service and we offer a money back guarantee for 30 days. ⭐【90 DAY WARRANTY】 - We stand behind our products; Please read our 'About us' page for more info. We take product customization requests through Amazon Messages",active,4.1
