Handle,Title,Published,Option1 Name,Option1 Value,Option2 Name,Option2 Value,Variant Inventory Tracker,Variant Inventory Qty,Variant Inventory Policy,Variant Fulfillment Service,Variant Price,Variant Requires Shipping,Variant Taxable,Image Src,Image Position,Description,Status,Rating
Dazzlingrock-Collection-0.10-Carat-(ctw)-Round-White-Diamond-Stackable-Wedding-Band-for-Her-in-10K-Gold,Dazzlingrock Collection 0.10 Carat (ctw) Round White Diamond Stackable Wedding Band for Her in 10K Gold,true,Product details,📋【SPECIFICATIONS】 - 10K Rose Gold 🔹 White Diamond Color: I-J | Clarity: I2-I3 | Creation: Natural | Treatment: Not-treated 🔹 Round White Diamond(s) Weight: 0.10 Carat 🔹 Model Number: K6767-10KR-4,Size,"['4,4.5,5,5.5,6,6.5,7,7.5,8,8.5,9,9.5,10']",Shopify,1000,deny,manual,$139.10,TRUE,TRUE,"['https://m.media-amazon.com/images/W/MEDIAX_792452-T1/images/I/4189JJ1r2ZL._AC_US40_.jpg', 'https://m.media-amazon.com/images/W/MEDIAX_792452-T1/images/I/4189JJ1r2ZL._AC_US40_.jpg', 'https://m.media-amazon.com/images/W/MEDIAX_792452-T1/images/I/31Aud9n52iL._AC_US40_.jpg', 'https://m.media-amazon.com/images/W/MEDIAX_792452-T1/images/I/31uxN2gqnGL._AC_US40_.jpg', 'https://m.media-amazon.com/images/W/MEDIAX_792452-T1/images/I/51tbecJadfL._AC_US40_.jpg', 'https://m.media-amazon.com/images/W/MEDIAX_792452-T1/images/I/417b--UNM2L._AC_US40_.jpg', 'https://m.media-amazon.com/images/W/MEDIAX_792452-T1/images/I/51F32630-JL._AC_US40_.jpg', 'https://images-na.ssl-images-amazon.com/images/G/01/x-locale/common/transparent-pixel._V192234675_.gif']",1,"📋【SPECIFICATIONS】 - 10K Rose Gold 🔹 White Diamond Color: I-J | Clarity: I2-I3 | Creation: Natural | Treatment: Not-treated 🔹 Round White Diamond(s) Weight: 0.10 Carat 🔹 Model Number: K6767-10KR-4 💎 When it comes to giving gifts, there is always a DIAMOND as it means “FOREVER”; So make this the ultimate jewelry gift idea for Women, Wife, Fiancée, Moms, Sisters and In-laws, Valentine's - Anniversary, Mother's Day or Christmas. ❗【DISCLAIMER】 - Item(s) are smaller than what appears in photo; Photo enlarged to show detail. For precise dimensions, we kindly request you to refer to the scale image located under the product photos. It provides an accurate representation of the item's proportions, allowing you to make an informed decision about its size. ✅【GUARANTEE】 - We take great pride in ensuring that all our diamonds are ethically sourced, guaranteeing that they are conflict-free. Moreover, we go above and beyond to provide exceptional customer service to back our products. We proudly back our products with a generous 30-day money-back guarantee, providing you with complete peace of mind. ⭐【90 DAY WARRANTY】 - At our company, we take immense pride in the quality of our products, and we wholeheartedly stand behind them. For a deeper understanding of our values and mission, we invite you to explore our comprehensive 'About Us' page. To make your experience even more tailored, we welcome product customization requests through Amazon Messages, allowing you to personalize your order to perfection 🔸 If you require ring sizes not shown above, please reach out to us",active,4.1
Dazzlingrock-Collection-Round-Blue-Sapphire-&-White-Diamond-crisscross-Style-Swirl-Stackable-Wedding-Band-in-Gold,Dazzlingrock Collection Round Blue Sapphire & White Diamond crisscross Style Swirl Stackable Wedding Band in Gold,true,Product details,📋【SPECIFICATIONS】 - 10K Rose Gold 🔹 Natural Sapphire Color: Blue | Treatment: Heat-treated 🔹 Natural White Diamond Color: I-J | Clarity: I2-I3 | Treatment: Not-treated 🔹 Round Natural Blue Sapphire(s) Size: 0.75mm(approx) each 🔹 Round Natural White Diamond(s) Weight: 0.11 Carat 🔹 Product Width: 2.3mm (0.09 inch) 🔹 Model Number: DR4761-1987-10KR-4,Size,"['4,4.5,5,5.5,6,6.5,7,7.5,8,8.5,9,9.5,10']",Shopify,1000,deny,manual,$229.73,TRUE,TRUE,"['https://m.media-amazon.com/images/W/MEDIAX_792452-T1/images/I/41CdVt4HQML._AC_US40_.jpg', 'https://m.media-amazon.com/images/W/MEDIAX_792452-T1/images/I/51irTWrn3iL._AC_US40_.jpg', 'https://m.media-amazon.com/images/W/MEDIAX_792452-T1/images/I/31aNYWNAMOL._AC_US40_.jpg', 'https://m.media-amazon.com/images/W/MEDIAX_792452-T1/images/I/31r8yKSx38L._AC_US40_.jpg', 'https://m.media-amazon.com/images/W/MEDIAX_792452-T1/images/I/41Y+J627uzL._AC_US40_.jpg', 'https://m.media-amazon.com/images/W/MEDIAX_792452-T1/images/I/51eKhThL5qL._AC_US40_.jpg', 'https://m.media-amazon.com/images/W/MEDIAX_792452-T1/images/I/51eG2wff1tL.SS40_PKmb-play-button-overlay-thumb_.jpg', 'https://images-na.ssl-images-amazon.com/images/G/01/x-locale/common/transparent-pixel._V192234675_.gif']",1,"📋【SPECIFICATIONS】 - 10K Rose Gold 🔹 Natural Sapphire Color: Blue | Treatment: Heat-treated 🔹 Natural White Diamond Color: I-J | Clarity: I2-I3 | Treatment: Not-treated 🔹 Round Natural Blue Sapphire(s) Size: 0.75mm(approx) each 🔹 Round Natural White Diamond(s) Weight: 0.11 Carat 🔹 Product Width: 2.3mm (0.09 inch) 🔹 Model Number: DR4761-1987-10KR-4 💎 Blue Sapphire, these regal gemstones are fit for royalty; Princess Diana and Kate both chose this blue stone over traditional white diamonds; Meaning: You'll always be honest and loyal to each other. ❗【DISCLAIMER】 - Item(s) are smaller than what appears in photo; Photo enlarged to show detail. Please refer to the scale image under product photos for exact dimensions. ✅【GUARANTEE】 - All our stones are conflict free, our products are backed by incredible customer service and we offer a money back guarantee for 30 days. ⭐【90 DAY WARRANTY】 - We stand behind our products; Please read our 'About us' page for more info. We take product customization requests through Amazon Messages",active,4.3
"Surgical-Stainless-Steel-Domed-8mm-Wedding-Band-Thumb-Ring-Comfort-Fit-High-Polish,-Sizes-5-15","Surgical Stainless Steel Domed 8mm Wedding Band Thumb Ring Comfort-Fit High Polish, Sizes 5-15",true,Product details,This is a 8mm Domed Wedding Ring size 5 for Women,Size,"['5,5.5,6,6.5,7,7.5,8,8.5,9,9.5,10,10.5,11,11.5,12,12.5,13,13.5,14,14.5,15']",Shopify,1000,deny,manual,$7.95,TRUE,TRUE,"['https://m.media-amazon.com/images/W/MEDIAX_792452-T1/images/I/410DoihqVnL._AC_US40_.jpg', 'https://m.media-amazon.com/images/W/MEDIAX_792452-T1/images/I/51-qctwRKQL._AC_US40_.jpg', 'https://m.media-amazon.com/images/W/MEDIAX_792452-T1/images/I/512PXMvO1eL._AC_US40_.jpg', 'https://m.media-amazon.com/images/W/MEDIAX_792452-T1/images/I/41ywncdaeyL._AC_US40_.jpg', 'https://m.media-amazon.com/images/W/MEDIAX_792452-T1/images/I/41-NEBqU7sL._AC_US40_.jpg', 'https://images-na.ssl-images-amazon.com/images/G/01/x-locale/common/transparent-pixel._V192234675_.gif']",1,This is a 8mm Domed Wedding Ring size 5 for Women Brushed Finish Comfort Fit Domed Wedding Ring Surgical Quality 316L Stainless Steel Ring for Men and Women Excellent Quality Workmanship Flawless Finish with the look of Platinum Smooth and engraveable interior,active,4.6
"Dazzlingrock-Collection-Round-White-Diamond-Five-Stone-Bridal-Engagement-Ring-Matching-Band-Set-for-Her-(0.45-ctw,-Color-I-J,-Clarity-I1-I3)-in-Gold","Dazzlingrock Collection Round White Diamond Five Stone Bridal Engagement Ring Matching Band Set for Her (0.45 ctw, Color I-J, Clarity I1-I3) in Gold",true,Product details,📋【SPECIFICATIONS】 - 10K Rose Gold 🔹 White Diamond Color: I-J | Clarity: I2-I3 | Creation: Natural | Treatment: Not-treated 🔹 Round White Diamond(s) Weight: 0.45 Carat 🔹 Product Width: 4.8mm (0.19 inch) 🔹 Model Number: K1412-10KR-4,Size,"['4,4.5,5,5.5,6,6.5,7,7.5,8,8.5,9,9.5,10']",Shopify,1000,deny,manual,$565.18,TRUE,TRUE,"['https://m.media-amazon.com/images/W/MEDIAX_792452-T1/images/I/514umTP3aPL._AC_US40_.jpg', 'https://m.media-amazon.com/images/W/MEDIAX_792452-T1/images/I/31tcQ0ErcAL._AC_US40_.jpg', 'https://m.media-amazon.com/images/W/MEDIAX_792452-T1/images/I/41pkQ-5xjAL._AC_US40_.jpg', 'https://m.media-amazon.com/images/W/MEDIAX_792452-T1/images/I/415lEBEzQzL._AC_US40_.jpg', 'https://m.media-amazon.com/images/W/MEDIAX_792452-T1/images/I/31FfL9cO45L._AC_US40_.jpg', 'https://m.media-amazon.com/images/W/MEDIAX_792452-T1/images/I/515j9MKp5vL._AC_US40_.jpg', 'https://m.media-amazon.com/images/W/MEDIAX_792452-T1/images/I/515j9MKp5vL._AC_US40_.jpg', 'https://images-na.ssl-images-amazon.com/images/G/01/x-locale/common/transparent-pixel._V192234675_.gif']",1,"📋【SPECIFICATIONS】 - 10K Rose Gold 🔹 White Diamond Color: I-J | Clarity: I2-I3 | Creation: Natural | Treatment: Not-treated 🔹 Round White Diamond(s) Weight: 0.45 Carat 🔹 Product Width: 4.8mm (0.19 inch) 🔹 Model Number: K1412-10KR-4 💎 When it comes to giving gifts, there is always a DIAMOND as it means “FOREVER”; So make this the ultimate jewelry gift idea for Women, Wife, Fiancée, Moms, Sisters and In-laws, Valentine's - Anniversary, Mother's Day or Christmas. ❗【DISCLAIMER】 - Item(s) are smaller than what appears in photo; Photo enlarged to show detail. Please refer to the scale image under product photos for exact dimensions. ✅【GUARANTEE】 - All our diamonds are conflict free, our products are backed by incredible customer service and we offer a money back guarantee for 30 days. ⭐【90 DAY WARRANTY】 - We stand behind our products; Please read our 'About us' page for more info. We take product customization requests through Amazon Messages",active,3.6
"Surgical-Steel-Plain-Wedding-Band-Thumb-Ring/Toe-Ring-3mm-Domed-Comfort-Fit-High-Polish,-Sizes-5-12","Surgical Steel Plain Wedding Band Thumb Ring/Toe Ring 3mm Domed Comfort-Fit High Polish, Sizes 5-12",true,Product details,High Quality 316L SURGICAL Steel Ring,Size,"['5,5.5,6,6.5,7,7.5,8,8.5,9,9.5,10,10.5,11,11.5,12']",Shopify,1000,deny,manual,$7.95,TRUE,TRUE,"['https://m.media-amazon.com/images/W/MEDIAX_792452-T1/images/I/41jDed95mWL._AC_US40_.jpg', 'https://m.media-amazon.com/images/W/MEDIAX_792452-T1/images/I/51-qctwRKQL._AC_US40_.jpg', 'https://m.media-amazon.com/images/W/MEDIAX_792452-T1/images/I/512PXMvO1eL._AC_US40_.jpg', 'https://m.media-amazon.com/images/W/MEDIAX_792452-T1/images/I/41ywncdaeyL._AC_US40_.jpg', 'https://m.media-amazon.com/images/W/MEDIAX_792452-T1/images/I/41-NEBqU7sL._AC_US40_.jpg', 'https://images-na.ssl-images-amazon.com/images/G/01/x-locale/common/transparent-pixel._V192234675_.gif']",1,High Quality 316L SURGICAL Steel Ring Excellent Quality Workmanship Hypoallergenic Smooth and engraveable interior,active,4.6
"Dazzlingrock-Collection-Alternate-Round-Blue-&-White-Diamond-Stackable-Ring-for-Women-(0.15-ctw,-Clarity-I1-I3)-in-Gold","Dazzlingrock Collection Alternate Round Blue & White Diamond Stackable Ring for Women (0.15 ctw, Clarity I1-I3) in Gold",true,Product details,📋SPECIFICATIONS - 10K Rose Gold🔹Diamond Color: Blue | Clarity: I2-I3 | Creation: Natural | Treatment: Treated for Color(permanent)🔹White Diamond Color: I-J | Clarity: I2-I3🔹Round Natural Blue Diamond Weight: 0.08 Carat🔹Round White Diamond(s) Weight: 0.07 Carat🔹Total Diamond Weight: 0.15 Carat🔹Product Width: 1.40mm (0.06 inch)🔹Model Number: DR1361-1486-10KR-4,Size,"['4,4.5,5,5.5,6,6.5,7,7.5,8,8.5,9,9.5,10']",Shopify,1000,deny,manual,$170.85,TRUE,TRUE,"['https://m.media-amazon.com/images/W/MEDIAX_792452-T1/images/I/31sVdc0ar3L._AC_US40_.jpg', 'https://m.media-amazon.com/images/W/MEDIAX_792452-T1/images/I/51OoLs5ze1L._AC_US40_.jpg', 'https://m.media-amazon.com/images/W/MEDIAX_792452-T1/images/I/51+g1hf+xEL._AC_US40_.jpg', 'https://m.media-amazon.com/images/W/MEDIAX_792452-T1/images/I/41OQm2iypKL._AC_US40_.jpg', 'https://m.media-amazon.com/images/W/MEDIAX_792452-T1/images/I/515j9MKp5vL._AC_US40_.jpg', 'https://m.media-amazon.com/images/W/MEDIAX_792452-T1/images/I/51F32630-JL._AC_US40_.jpg', 'https://m.media-amazon.com/images/I/91JP4PBUx7L.SS40_PKmb-play-button-overlay-thumb_.png', 'https://images-na.ssl-images-amazon.com/images/G/01/x-locale/common/transparent-pixel._V192234675_.gif']",1,"📋SPECIFICATIONS - 10K Rose Gold🔹Diamond Color: Blue | Clarity: I2-I3 | Creation: Natural | Treatment: Treated for Color(permanent)🔹White Diamond Color: I-J | Clarity: I2-I3🔹Round Natural Blue Diamond Weight: 0.08 Carat🔹Round White Diamond(s) Weight: 0.07 Carat🔹Total Diamond Weight: 0.15 Carat🔹Product Width: 1.40mm (0.06 inch)🔹Model Number: DR1361-1486-10KR-4 💎Blue Diamonds represent faith and trust, important elements in any relationship. They symbolize peace, truth, devotion, eternity, chastity, and spirituality. ❗DISCLAIMER - Items is smaller than what appears in photo; Photo enlarged to show detail. Please refer to the scale image under product photos for exact dimensions. ✅GUARANTEE - All our diamonds are conflict free, our products are backed by incredible customer service and we offer a money back guarantee for 30 days. ⭐90 DAY WARRANTY - We stand behind our products; Please read our 'About us' page for more info. We take product customization requests through Amazon Messages.",active,5.0
Dazzlingrock-Collection-Round-Amethyst-&-White-Diamond-Alternate-Stone-Wedding-Band-for-Women-in-10K-Gold,Dazzlingrock Collection Round Amethyst & White Diamond Alternate Stone Wedding Band for Women in 10K Gold,true,Product details,📋【SPECIFICATIONS】 - 10K Rose Gold 🔹 Natural Amethyst Color: Purple | Treatment: Heat-treated 🔹 Natural White Diamond Color: I-J | Clarity: I2-I3 | Treatment: Not-treated 🔹 Round Natural Amethyst(s) Size: 1.35mm(approx) each 🔹 Round Natural White Diamond(s) Weight: 0.06 Carat 🔹 Product Width: 2.30mm (0.09 inch) 🔹 Model Number: DR10082-4371-10KR-4,Size,"['4,4.5,5,5.5,6,6.5,7,7.5,8,8.5,9,9.5,10']",Shopify,1000,deny,manual,$176.15,TRUE,TRUE,"['https://m.media-amazon.com/images/W/MEDIAX_792452-T1/images/I/41LlgG6D31L._AC_US40_.jpg', 'https://m.media-amazon.com/images/W/MEDIAX_792452-T1/images/I/41X9w3q17LL._AC_US40_.jpg', 'https://m.media-amazon.com/images/W/MEDIAX_792452-T1/images/I/3196V98d0VL._AC_US40_.jpg', 'https://m.media-amazon.com/images/W/MEDIAX_792452-T1/images/I/316I2x-PFcL._AC_US40_.jpg', 'https://m.media-amazon.com/images/W/MEDIAX_792452-T1/images/I/41IhFbXuAxL._AC_US40_.jpg', 'https://m.media-amazon.com/images/W/MEDIAX_792452-T1/images/I/515j9MKp5vL._AC_US40_.jpg', 'https://images-na.ssl-images-amazon.com/images/G/01/x-locale/common/transparent-pixel._V192234675_.gif']",1,"📋【SPECIFICATIONS】 - 10K Rose Gold 🔹 Natural Amethyst Color: Purple | Treatment: Heat-treated 🔹 Natural White Diamond Color: I-J | Clarity: I2-I3 | Treatment: Not-treated 🔹 Round Natural Amethyst(s) Size: 1.35mm(approx) each 🔹 Round Natural White Diamond(s) Weight: 0.06 Carat 🔹 Product Width: 2.30mm (0.09 inch) 🔹 Model Number: DR10082-4371-10KR-4 💎 Amethyst's purple color is well-known for it's cleansing and calming energy. The crystals represent purification and connection to spiritual and divine beings. The meaning of amethyst is attached to serenity, understanding, trust and grace. ❗【DISCLAIMER】 - Item(s) are smaller than what appears in photo; Photo enlarged to show detail. For precise dimensions, we kindly request you to refer to the scale image located under the product photos. It provides an accurate representation of the item's proportions, allowing you to make an informed decision about its size. ✅【GUARANTEE】 - We take great pride in ensuring that all our gemstones are ethically sourced, guaranteeing that they are conflict-free. Moreover, we go above and beyond to provide exceptional customer service to back our products. We proudly back our products with a generous 30-day money-back guarantee, providing you with complete peace of mind. ⭐【90 DAY WARRANTY】 - At our company, we take immense pride in the quality of our products, and we wholeheartedly stand behind them. For a deeper understanding of our values and mission, we invite you to explore our comprehensive 'About Us' page. To make your experience even more tailored, we welcome product customization requests through Amazon Messages, allowing you to personalize your order to perfection 🔸 If you require ring sizes not shown above, please reach out to us",active,3.0
"Dazzlingrock-Collection-Round-White-Diamond-Stackable-Wedding-Band-for-Women-(0.08-ctw,-Color-I-J,-Clarity-I1-I2)-in-18K-Gold","Dazzlingrock Collection Round White Diamond Stackable Wedding Band for Women (0.08 ctw, Color I-J, Clarity I1-I2) in 18K Gold",true,Product details,📋【SPECIFICATIONS】 - 18K Rose Gold 🔹 White Diamond Color: I-J | Clarity: I1-I2 | Creation: Natural | Treatment: Not-treated 🔹 Round White Diamond(s) Weight: 0.08 Carat 🔹 Product Width: 1.00mm (0.03 inch) 🔹 Model Number: K1986-18KR-4,Size,"['4,4.5,5,5.5,6,6.5,7,7.5,8,8.5,9,9.5,10']",Shopify,1000,deny,manual,$229.73,TRUE,TRUE,"['https://m.media-amazon.com/images/W/MEDIAX_792452-T1/images/I/31bzLYgZHWL._AC_US40_.jpg', 'https://m.media-amazon.com/images/W/MEDIAX_792452-T1/images/I/41KayXPyelL._AC_US40_.jpg', 'https://m.media-amazon.com/images/W/MEDIAX_792452-T1/images/I/41p1I7DxNtS._AC_US40_.jpg', 'https://m.media-amazon.com/images/W/MEDIAX_792452-T1/images/I/31-JrrVcU2L._AC_US40_.jpg', 'https://m.media-amazon.com/images/W/MEDIAX_792452-T1/images/I/312vQNYRBAL._AC_US40_.jpg', 'https://m.media-amazon.com/images/W/MEDIAX_792452-T1/images/I/4115KN18OhL._AC_US40_.jpg', 'https://m.media-amazon.com/images/W/MEDIAX_792452-T1/images/I/51noNxQssaL.SS40_PKmb-play-button-overlay-thumb_.jpg', 'https://images-na.ssl-images-amazon.com/images/G/01/x-locale/common/transparent-pixel._V192234675_.gif']",1,"📋【SPECIFICATIONS】 - 18K Rose Gold 🔹 White Diamond Color: I-J | Clarity: I1-I2 | Creation: Natural | Treatment: Not-treated 🔹 Round White Diamond(s) Weight: 0.08 Carat 🔹 Product Width: 1.00mm (0.03 inch) 🔹 Model Number: K1986-18KR-4 💎 When it comes to giving gifts, there is always a DIAMOND as it means “FOREVER”; So make this the ultimate jewelry gift idea for Women, Wife, Fiancée, Moms, Sisters and In-laws, Valentine's - Anniversary, Mother's Day or Christmas. ❗【DISCLAIMER】 - Item(s) are smaller than what appears in photo; Photo enlarged to show detail. Please refer to the scale image under product photos for exact dimensions. ✅【GUARANTEE】 - All our diamonds are conflict free, our products are backed by incredible customer service and we offer a money back guarantee for 30 days. ⭐【90 DAY WARRANTY】 - We stand behind our products; Please read our 'About us' page for more info. We take product customization requests through Amazon Messages",active,3.1
Dazzlingrock-Collection-Alternate-Round-Peridot-&-Diamond-Stackable-Wedding-Band-for-Women-in-Gold,Dazzlingrock Collection Alternate Round Peridot & Diamond Stackable Wedding Band for Women in Gold,true,Product details,📋【SPECIFICATIONS】 - 10K Rose Gold 🔹 Peridot Color: Green | Creation: Natural | Treatment: Heat-treated 🔹 White Diamond Color: I-J | Clarity: I2-I3 🔹 Round Natural Peridot(s) Weight: 0.08 Carat (approx) 🔹 Round White Diamond(s) Weight: 0.07 Carat 🔹 Product Width: 1.30mm (0.05 inch) 🔹 Model Number: DR12307-3008-10KR-4,Size,"['4,4.5,5,5.5,6,6.5,7,7.5,8,8.5,9,9.5,10']",Shopify,1000,deny,manual,$159.51,TRUE,TRUE,"['https://m.media-amazon.com/images/W/MEDIAX_792452-T1/images/I/315uQOnfGiL._AC_US40_.jpg', 'https://m.media-amazon.com/images/W/MEDIAX_792452-T1/images/I/41juQEhBanL._AC_US40_.jpg', 'https://m.media-amazon.com/images/W/MEDIAX_792452-T1/images/I/31au9CtSadL._AC_US40_.jpg', 'https://m.media-amazon.com/images/W/MEDIAX_792452-T1/images/I/31rEt66XhHL._AC_US40_.jpg', 'https://m.media-amazon.com/images/W/MEDIAX_792452-T1/images/I/41EZWVxhGRL._AC_US40_.jpg', 'https://m.media-amazon.com/images/W/MEDIAX_792452-T1/images/I/515j9MKp5vL._AC_US40_.jpg', 'https://m.media-amazon.com/images/W/MEDIAX_792452-T1/images/I/41cltssWbEL._AC_US40_.jpg', 'https://images-na.ssl-images-amazon.com/images/G/01/x-locale/common/transparent-pixel._V192234675_.gif']",1,"📋【SPECIFICATIONS】 - 10K Rose Gold 🔹 Peridot Color: Green | Creation: Natural | Treatment: Heat-treated 🔹 White Diamond Color: I-J | Clarity: I2-I3 🔹 Round Natural Peridot(s) Weight: 0.08 Carat (approx) 🔹 Round White Diamond(s) Weight: 0.07 Carat 🔹 Product Width: 1.30mm (0.05 inch) 🔹 Model Number: DR12307-3008-10KR-4 💎 Peridot, this merry green stone seems to light up with laughter. A secret message between you and your lover, it playfully says, ""I know who you are, I trust you, and I love you dearly!"" ❗【DISCLAIMER】 - Item(s) are smaller than what appears in photo; Photo enlarged to show detail. Please refer to the scale image under product photos for exact dimensions. ✅【GUARANTEE】 - All our stones are conflict free, our products are backed by incredible customer service and we offer a money back guarantee for 30 days. ⭐【90 DAY WARRANTY】 - We stand behind our products; Please read our 'About us' page for more info. We take product customization requests through Amazon Messages",active,3.4
"Dazzlingrock-Collection-0.12-Carat-(ctw)-Round-Black-Diamond-Thin-Milgrain-Stackable-Wedding-Band-Ring-for-Ladies,-Available-in-Various-Metal-in-10K/14K/18K-Gold","Dazzlingrock Collection 0.12 Carat (ctw) Round Black Diamond Thin Milgrain Stackable Wedding Band Ring for Ladies, Available in Various Metal in 10K/14K/18K Gold",true,Product details,This classic black diamond band ring is a piece of jewel that will certainly amaze you.,Size,,Shopify,1000,deny,manual,Page 1 of 1,TRUE,TRUE,"['https://m.media-amazon.com/images/W/MEDIAX_792452-T1/images/I/51cJd-xz85L._AC_US40_.jpg', 'https://m.media-amazon.com/images/W/MEDIAX_792452-T1/images/I/51bt7p1-3NL._AC_US40_.jpg', 'https://m.media-amazon.com/images/W/MEDIAX_792452-T1/images/I/31ERCjQk2YL._AC_US40_.jpg', 'https://m.media-amazon.com/images/W/MEDIAX_792452-T1/images/I/51Bv05cl9AL._AC_US40_.jpg', 'https://m.media-amazon.com/images/W/MEDIAX_792452-T1/images/I/4176rA6wT5L._AC_US40_.jpg', 'https://m.media-amazon.com/images/W/MEDIAX_792452-T1/images/I/515j9MKp5vL._AC_US40_.jpg', 'https://m.media-amazon.com/images/W/MEDIAX_792452-T1/images/I/51F32630-JL._AC_US40_.jpg', 'https://images-na.ssl-images-amazon.com/images/G/01/x-locale/common/transparent-pixel._V192234675_.gif']",1,"This classic black diamond band ring is a piece of jewel that will certainly amaze you. Items is smaller than what appears in photo. Photo enlarged to show detail. All our diamonds are conflict free. Gemstone : Diamond 100% SATISFACTION GUARANTEE - All our diamonds are conflict free, Our products are backed by incredible customer service and We offer a 100% satisfaction money back guarantee for 30 days. When it comes to giving gifts, there is always a DIAMOND as it means “FOREVER”. So make this the ultimate jewelry gift idea for women, Moms, Fiancé, Sisters and In-laws, Valentine's - Mother's Day or Christmas. Dazzlingrock 90 Day Warranty - We stand behind our products. If you lose an accent stone or your setting is damaged during NORMAL wear, we will fix it for FREE. Please read our About us page for more info",active,5.0
Dazzlingrock-Collection-1.65-Carat-(ctw)-Round-Cubic-Zirconia-Wedding-Enhancer-Guard-Ring-for-Women-in-Gold,Dazzlingrock Collection 1.65 Carat (ctw) Round Cubic Zirconia Wedding Enhancer Guard Ring for Women in Gold,true,Product details,📋【SPECIFICATIONS】 - 10K Rose Gold 🔹 Cubic Zirconia Color: White | Clarity: Clean | Creation: Synthetic | Treatment: Not-treated 🔹 Round Cubic Zirconia(s) Weight: 1.65 Carat 🔹 Product Width: 10.50mm (0.41 inch) 🔹 Model Number: K6762-CZ-10KR-4,Size,"['4,4.5,5,5.5,6,6.5,7,7.5,8,8.5,9,9.5,10']",Shopify,1000,deny,manual,$282.26,TRUE,TRUE,"['https://m.media-amazon.com/images/W/MEDIAX_792452-T1/images/I/51X1EVUvUjL._AC_US40_.jpg', 'https://m.media-amazon.com/images/W/MEDIAX_792452-T1/images/I/41bMQPSORLL._AC_US40_.jpg', 'https://m.media-amazon.com/images/W/MEDIAX_792452-T1/images/I/41yKJCt3TlL._AC_US40_.jpg', 'https://m.media-amazon.com/images/W/MEDIAX_792452-T1/images/I/51QqeAW840L._AC_US40_.jpg', 'https://m.media-amazon.com/images/W/MEDIAX_792452-T1/images/I/51jalqhz75L._AC_US40_.jpg', 'https://m.media-amazon.com/images/W/MEDIAX_792452-T1/images/I/515j9MKp5vL._AC_US40_.jpg', 'https://m.media-amazon.com/images/W/MEDIAX_792452-T1/images/I/51F32630-JL._AC_US40_.jpg', 'https://images-na.ssl-images-amazon.com/images/G/01/x-locale/common/transparent-pixel._V192234675_.gif']",1,"📋【SPECIFICATIONS】 - 10K Rose Gold 🔹 Cubic Zirconia Color: White | Clarity: Clean | Creation: Synthetic | Treatment: Not-treated 🔹 Round Cubic Zirconia(s) Weight: 1.65 Carat 🔹 Product Width: 10.50mm (0.41 inch) 🔹 Model Number: K6762-CZ-10KR-4 💎 Cubic Zirconia is believed to improve focus, increase clarity and release the ego. Called ""The Stone of Practicality"", people use it for keeping themselves grounded. While some wear cubic zirconia to remove illusion and drain selfishness. ❗【DISCLAIMER】 - Product photos are enlarged to show detail, it is important to refer to the scale image to determine the exact dimensions of the item. The scale image and the discrepancy in size between the photo and the actual product. ✅【GUARANTEE】 - We are dedicated to offering only conflict-free stones, backed by our unwavering commitment to exceptional customer service. As a testament to our confidence in the quality of our products, we provide a 30-day money back guarantee. ⭐【90 DAY WARRANTY】 - At our company, we take immense pride in the quality of our products, and we wholeheartedly stand behind them. For a deeper understanding of our values and mission, we invite you to explore our comprehensive 'About Us' page. To make your experience even more tailored, we welcome product customization requests through Amazon Messages, allowing you to personalize your order to perfection.",active,3.8
